[
 {
  "id": "DB-001",
  "name": "数据库基础概念",
  "difficulty": 1,
  "category": "数据库与缓存",
  "summary": "数据库是结构化存储与管理数据的系统, 核心目标: 持久化、并发安全、高效查询与事务保证。按模型分关系型(SQL: MySQL/PostgreSQL)与非关系型(NoSQL: Redis/MongoDB)。数据库与文件存储的区别在于: 事务、索引、查询语言与并发控制等系统化能力。",
  "prerequisites": [],
  "key_points": [
   "持久化 + 并发安全 + 高效查询 + 事务",
   "关系型(SQL) vs 非关系型(NoSQL)",
   "DBMS 提供事务/索引/查询语言/并发控制",
   "数据独立性: 逻辑/物理层分离",
   "选型取决于一致性需求/规模/访问模式"
  ],
  "practice_questions": [
   {
    "type": "choice",
    "question": "数据库基础概念核心要点确认",
    "options": [
     "已理解",
     "需复习"
    ],
    "answer": "A",
    "difficulty": 1
   }
  ],
  "common_mistakes": [
   "把数据库当普通文件用, 忽略事务与索引",
   "选型只看流行度不看场景匹配"
  ],
  "tags": [
   "数据库",
   "数据库基础概念"
  ],
  "estimated_minutes": 20
 },
 {
  "id": "DB-002",
  "name": "关系模型与 SQL 基础",
  "difficulty": 1,
  "category": "数据库与缓存",
  "summary": "关系模型用二维表组织数据: 行(记录)列(字段), 表间用外键关联。SQL 是关系数据库标准语言, 分 DDL(建表/改结构)、DML(增删改查)、DQL(查询)、DCL(权限)。基本查询: SELECT 列 FROM 表 WHERE 条件。",
  "prerequisites": [
   "DB-001"
  ],
  "key_points": [
   "表(行=记录, 列=字段)是关系模型核心",
   "外键建立表间关联",
   "SQL 分类: DDL/DML/DQL/DCL",
   "SELECT-FROM-WHERE 基本查询骨架",
   "主键唯一标识行, 非空唯一"
  ],
  "practice_questions": [
   {
    "type": "choice",
    "question": "关系模型与 SQL 基础核心要点确认",
    "options": [
     "已理解",
     "需复习"
    ],
    "answer": "A",
    "difficulty": 1
   }
  ],
  "common_mistakes": [
   "无主键的表难以定位行",
   "外键约束缺失导致脏数据"
  ],
  "tags": [
   "数据库",
   "关系模型与 SQL 基础"
  ],
  "estimated_minutes": 25
 },
 {
  "id": "DB-003",
  "name": "SQL 查询进阶",
  "difficulty": 2,
  "category": "数据库与缓存",
  "summary": "进阶查询: JOIN 连接多表(inner/left/right)、GROUP BY 分组聚合、HAVING 过滤分组、子查询与 EXISTS、UNION 合并结果集。理解执行顺序(FROM->WHERE->GROUP->HAVING->SELECT->ORDER) 是写对复杂查询的关键。",
  "prerequisites": [
   "DB-002"
  ],
  "key_points": [
   "JOIN: inner/left/right/full 多表连接",
   "GROUP BY + HAVING 分组后过滤",
   "子查询/EXISTS 表达嵌套条件",
   "执行顺序: FROM->WHERE->GROUP->SELECT->ORDER",
   "UNION 合并(去重) / UNION ALL(不去重更快)"
  ],
  "practice_questions": [
   {
    "type": "choice",
    "question": "SQL 查询进阶核心要点确认",
    "options": [
     "已理解",
     "需复习"
    ],
    "answer": "A",
    "difficulty": 1
   }
  ],
  "common_mistakes": [
   "混淆 WHERE(过滤行)与 HAVING(过滤分组)",
   "LEFT JOIN 后用 WHERE 过滤右表变 INNER JOIN 语义"
  ],
  "tags": [
   "数据库",
   "SQL 查询进阶"
  ],
  "estimated_minutes": 30
 },
 {
  "id": "DB-004",
  "name": "索引原理",
  "difficulty": 3,
  "category": "数据库与缓存",
  "summary": "索引是加速查询的辅助数据结构(多为 B+树): 让数据库避免全表扫描, 按列快速定位行。主键/外键/高频过滤列适合建索引, 但索引占空间且拖慢写操作。复合索引遵循最左前缀原则, 覆盖索引可免回表。索引不是越多越好。",
  "prerequisites": [
   "DB-003"
  ],
  "key_points": [
   "B+树索引: 范围查询高效",
   "主键/外键/高频过滤列建索引",
   "复合索引最左前缀原则",
   "覆盖索引免回表提速",
   "索引占空间+拖慢写, 非越多越好"
  ],
  "practice_questions": [
   {
    "type": "choice",
    "question": "索引原理核心要点确认",
    "options": [
     "已理解",
     "需复习"
    ],
    "answer": "A",
    "difficulty": 1
   }
  ],
  "common_mistakes": [
   "给所有列都建索引(写性能崩)",
   "复合索引列顺序随意(违反最左前缀失效)"
  ],
  "tags": [
   "数据库",
   "索引原理"
  ],
  "estimated_minutes": 35
 },
 {
  "id": "DB-005",
  "name": "事务与 ACID",
  "difficulty": 3,
  "category": "数据库与缓存",
  "summary": "事务是一组不可分割的操作, 满足 ACID: 原子性(全做或全不做)、一致性(约束不被破坏)、隔离性(并发互不干扰)、持久性(提交后不丢)。显式事务用 BEGIN/COMMIT/ROLLBACK, 异常时回滚保证原子性。",
  "prerequisites": [
   "DB-003"
  ],
  "key_points": [
   "原子性 A: 全做或全不做",
   "一致性 C: 约束始终满足",
   "隔离性 I: 并发事务互不干扰",
   "持久性 D: 提交后落盘不丢",
   "BEGIN/COMMIT/ROLLBACK 控制事务边界"
  ],
  "practice_questions": [
   {
    "type": "choice",
    "question": "事务与 ACID核心要点确认",
    "options": [
     "已理解",
     "需复习"
    ],
    "answer": "A",
    "difficulty": 1
   }
  ],
  "common_mistakes": [
   "多步操作不用事务, 中途失败留脏数据",
   "混淆一致性与原子性"
  ],
  "tags": [
   "数据库",
   "事务与 ACID"
  ],
  "estimated_minutes": 35
 },
 {
  "id": "DB-006",
  "name": "并发控制与隔离级别",
  "difficulty": 4,
  "category": "数据库与缓存",
  "summary": "并发事务可能产生脏读(读未提交)、不可重复读(同行两次读不同)、幻读(同条件两次查行数不同)。隔离级别由低到高: 读未提交/读已提交/可重复读/串行化, 级别越高一致性越强但并发越低。锁(行锁/表锁)与 MVCC 多版本并发控制是实现手段。",
  "prerequisites": [
   "DB-005"
  ],
  "key_points": [
   "脏读/不可重复读/幻读 三类并发问题",
   "四级隔离: 读未提交->串行化",
   "MVCC: 多版本读不阻塞写",
   "锁粒度: 行锁 vs 表锁",
   "隔离级别越高一致性越强但吞吐越低"
  ],
  "practice_questions": [
   {
    "type": "choice",
    "question": "并发控制与隔离级别核心要点确认",
    "options": [
     "已理解",
     "需复习"
    ],
    "answer": "A",
    "difficulty": 1
   }
  ],
  "common_mistakes": [
   "默认隔离级别不了解导致并发 bug",
   "为强一致盲目上串行化(吞吐骤降)"
  ],
  "tags": [
   "数据库",
   "并发控制与隔离级别"
  ],
  "estimated_minutes": 45
 },
 {
  "id": "DB-007",
  "name": "SQLite 数据库操作",
  "difficulty": 2,
  "category": "数据库与缓存",
  "summary": "SQLite 是嵌入式单文件数据库, 零配置零服务, 适合桌面应用/原型/测试。Python 标准库 sqlite3 直接连接 .db 文件, 支持 SQL 全集大部分功能。局限: 并发写靠文件锁(写串行), 不适合高并发服务端。",
  "prerequisites": [
   "DB-002",
   "PY-073"
  ],
  "key_points": [
   "嵌入式单文件, 零服务零配置",
   "sqlite3 标准库直连 .db 文件",
   "适合桌面/原型/测试场景",
   "并发写串行(WAL 模式改善)",
   "不适合高并发服务端写入"
  ],
  "practice_questions": [
   {
    "type": "choice",
    "question": "SQLite 数据库操作核心要点确认",
    "options": [
     "已理解",
     "需复习"
    ],
    "answer": "A",
    "difficulty": 1
   }
  ],
  "common_mistakes": [
   "用 SQLite 扛高并发写服务(锁竞争)",
   "文件当数据库跨进程共享不并发控制"
  ],
  "tags": [
   "数据库",
   "SQLite 数据库操作"
  ],
  "estimated_minutes": 25
 },
 {
  "id": "DB-008",
  "name": "数据库范式与设计",
  "difficulty": 4,
  "category": "数据库与缓存",
  "summary": "范式是减少数据冗余与异常的设计规范: 1NF 原子值、2NF 消除部分依赖、3NF 消除传递依赖、BCNF 更严格。实际设计在范式与查询性能间权衡, 适度反范式(冗余)换读取性能。ER 建模(实体-关系)是设计起点, 先理清实体与关系再落表结构。",
  "prerequisites": [
   "DB-003",
   "DB-007"
  ],
  "key_points": [
   "1NF 原子值 / 2NF 消部分依赖 / 3NF 消传递依赖",
   "BCNF 比 3NF 更严格",
   "适度反范式冗余换读取性能",
   "ER 建模: 实体-关系-属性",
   "设计先于实现: 先 ER 再落表"
  ],
  "practice_questions": [
   {
    "type": "choice",
    "question": "数据库范式与设计核心要点确认",
    "options": [
     "已理解",
     "需复习"
    ],
    "answer": "A",
    "difficulty": 1
   }
  ],
  "common_mistakes": [
   "过度追求高范式导致查询需大量 JOIN",
   "完全不规范化导致冗余与更新异常"
  ],
  "tags": [
   "数据库",
   "数据库范式与设计"
  ],
  "estimated_minutes": 45
 },
 {
  "id": "DB-009",
  "name": "ORM 对象关系映射",
  "difficulty": 3,
  "category": "数据库与缓存",
  "summary": "ORM 把表映射为类、行为对象, 用面向对象方式操作数据库, 自动生成 SQL。优势: 类型安全、防注入、减少样板代码; 代价: 性能开销与复杂查询表达受限。N+1 查询是 ORM 最常见性能陷阱, 需用预加载(eager load)规避。",
  "prerequisites": [
   "DB-007",
   "WD-010"
  ],
  "key_points": [
   "表->类, 行->对象, 自动生成 SQL",
   "类型安全 + 防注入 + 少样板",
   "代价: 性能开销/复杂查询受限",
   "N+1 查询陷阱用预加载规避",
   "性能敏感处可退回原生 SQL"
  ],
  "practice_questions": [
   {
    "type": "choice",
    "question": "ORM 对象关系映射核心要点确认",
    "options": [
     "已理解",
     "需复习"
    ],
    "answer": "A",
    "difficulty": 1
   }
  ],
  "common_mistakes": [
   "ORM 滥用导致 N+1 与低效查询",
   "完全依赖 ORM 不懂底层 SQL 无法调优"
  ],
  "tags": [
   "数据库",
   "ORM 对象关系映射"
  ],
  "estimated_minutes": 35
 },
 {
  "id": "DB-010",
  "name": "查询优化与执行计划",
  "difficulty": 4,
  "category": "数据库与缓存",
  "summary": "EXPLAIN 展示查询执行计划: 是否走索引、扫描行数、连接顺序。优化方向: 命中索引(避免全表扫描)、减少回表、合理连接顺序、只查所需列。慢查询日志定位问题查询, 优化遵循「先看计划再改」。",
  "prerequisites": [
   "DB-004",
   "DB-008"
  ],
  "key_points": [
   "EXPLAIN 看执行计划: 索引/扫描行数/连接顺序",
   "命中索引避免全表扫描",
   "覆盖索引/减少回表",
   "只查所需列别 SELECT *",
   "慢查询日志定位热点"
  ],
  "practice_questions": [
   {
    "type": "choice",
    "question": "查询优化与执行计划核心要点确认",
    "options": [
     "已理解",
     "需复习"
    ],
    "answer": "A",
    "difficulty": 1
   }
  ],
  "common_mistakes": [
   "不看执行计划凭直觉改 SQL",
   "SELECT * 返回多余列增加 IO"
  ],
  "tags": [
   "数据库",
   "查询优化与执行计划"
  ],
  "estimated_minutes": 45
 },
 {
  "id": "DB-011",
  "name": "数据库备份与恢复",
  "difficulty": 2,
  "category": "数据库与缓存",
  "summary": "备份是数据安全的底线: 全量备份(完整快照)+增量备份(只备变化)+日志归档(可点恢复)。恢复策略: 基于时间点恢复(PITR)利用归档日志回放。备份必须定期验证可恢复性--未验证的备份等于没有备份。",
  "prerequisites": [
   "DB-005"
  ],
  "key_points": [
   "全量+增量+日志归档组合备份",
   "PITR 基于时间点恢复",
   "备份须定期验证可恢复性",
   "RPO/RTO 定义备份恢复目标",
   "异地备份防机房级故障"
  ],
  "practice_questions": [
   {
    "type": "choice",
    "question": "数据库备份与恢复核心要点确认",
    "options": [
     "已理解",
     "需复习"
    ],
    "answer": "A",
    "difficulty": 1
   }
  ],
  "common_mistakes": [
   "只备份从不验证恢复(灾难时发现备份坏)",
   "备份和实例同机(机房故障全丢)"
  ],
  "tags": [
   "数据库",
   "数据库备份与恢复"
  ],
  "estimated_minutes": 30
 },
 {
  "id": "DB-012",
  "name": "高可用与主从复制",
  "difficulty": 4,
  "category": "数据库与缓存",
  "summary": "主从复制: 主库写、从库读, 提升读吞吐与容灾。主库故障可切换从库提升可用性。复制模式: 异步(性能高、可能丢数据)、半同步(折中)、同步(强一致、性能低)。主从延迟是读写分离的常见坑, 写后立即读需走主库。",
  "prerequisites": [
   "DB-006",
   "DB-011"
  ],
  "key_points": [
   "主写从读, 提升读吞吐与容灾",
   "异步/半同步/同步复制权衡",
   "主库故障切换从库提升可用性",
   "主从延迟: 写后立即读走主库",
   "脑裂风险需仲裁机制"
  ],
  "practice_questions": [
   {
    "type": "choice",
    "question": "高可用与主从复制核心要点确认",
    "options": [
     "已理解",
     "需复习"
    ],
    "answer": "A",
    "difficulty": 1
   }
  ],
  "common_mistakes": [
   "读写分离忽略主从延迟(读到旧数据)",
   "无自动故障切换导致主库宕机服务中断"
  ],
  "tags": [
   "数据库",
   "高可用与主从复制"
  ],
  "estimated_minutes": 45
 },
 {
  "id": "DB-013",
  "name": "Redis 数据结构与命令",
  "difficulty": 2,
  "category": "数据库与缓存",
  "summary": "Redis 是内存键值存储, 核心数据结构: String/Hash/List/Set/ZSet(有序集合)。单线程模型(命令原子执行)+IO多路复用实现高吞吐。常用场景: 缓存、计数器、排行榜(ZSet)、分布式锁、消息队列(List)。",
  "prerequisites": [
   "DB-001"
  ],
  "key_points": [
   "五大结构: String/Hash/List/Set/ZSet",
   "单线程+IO多路复用, 命令原子",
   "ZSet 天然适合排行榜",
   "过期键淘汰 + 内存上限",
   "原子操作: INCR/SETNX 适合计数与锁"
  ],
  "practice_questions": [
   {
    "type": "choice",
    "question": "Redis 数据结构与命令核心要点确认",
    "options": [
     "已理解",
     "需复习"
    ],
    "answer": "A",
    "difficulty": 1
   }
  ],
  "common_mistakes": [
   "把 Redis 当持久库(内存易丢)",
   "大 key(单值过大)拖垮单线程"
  ],
  "tags": [
   "数据库",
   "Redis 数据结构与命令"
  ],
  "estimated_minutes": 30
 },
 {
  "id": "DB-014",
  "name": "Redis 持久化与集群",
  "difficulty": 3,
  "category": "数据库与缓存",
  "summary": "Redis 持久化两种方式: RDB(周期快照, 恢复快可能丢)、AOF(追加日志, 更安全体积大)。集群方案: 主从复制(读写分离)、哨兵(自动故障转移)、Cluster(分片)。Redis 单实例有内存上限, Cluster 分片突破单机内存与吞吐。",
  "prerequisites": [
   "DB-013"
  ],
  "key_points": [
   "RDB 快照: 恢复快/可能丢数据",
   "AOF 日志: 更安全/体积大",
   "哨兵: 自动故障转移",
   "Cluster 分片: 突破单机内存与吞吐",
   "RDB+AOF 混合持久化折中"
  ],
  "practice_questions": [
   {